{
  "id": "warm-hearth",
  "product_name": "Digital Confidence Centre",
  "tagline": "Learn at your own pace, in your own home.",
  "base_url": "https://twobirds-kramerica.github.io/digital-confidence",
  "logo": {
    "path": "favicon.svg",
    "alt": "Digital Confidence Centre logo",
    "width": 32,
    "height": 32
  },
  "tokens_css": "css/tokens.css",
  "primary_colour": "#2A7B6F",
  "ga_id": "G-RPH5H5BM52",
  "clarity_id": "CLARITY_PROJECT_ID",
  "og_image_default": "https://twobirds-kramerica.github.io/digital-confidence/images/senior-woman-ipad.jpg",
  "nav_links": [
    { "href": "index.html",             "icon": "🏠", "label": "Home" },
    { "href": "digital-literacy-101.html", "icon": "📖", "label": "Foundations" },
    { "href": "module-1.html",          "icon": "🪂", "label": "1. The Escape Hatch" },
    { "href": "module-2.html",          "icon": "🛡️", "label": "2. Security Shield" },
    { "href": "module-2-5.html",        "icon": "📂", "label": "2.5 Everyday Tasks" },
    { "href": "module-3.html",          "icon": "🔑", "label": "3. Passwords" },
    { "href": "module-4.html",          "icon": "📱", "label": "4. App Store Safety" },
    { "href": "module-5.html",          "icon": "✉️", "label": "5. Email & Messages" },
    { "href": "module-6.html",          "icon": "🏦", "label": "6. Banking" },
    { "href": "module-7.html",          "icon": "🎨", "label": "7. Photos & Memories" },
    { "href": "module-8.html",          "icon": "👨‍👩‍👧", "label": "8. Stay Connected" },
    { "href": "module-9.html",          "icon": "🤖", "label": "9. Understanding AI" },
    { "href": "module-10.html",         "icon": "🛒", "label": "10. Grocery & Delivery" },
    { "href": "module-11.html",         "icon": "🚗", "label": "11. Ride-Sharing" },
    { "href": "module-12.html",         "icon": "🤝", "label": "12. Getting Help" },
    { "href": "module-13.html",         "icon": "👥", "label": "13. Social Media" },
    { "href": "module-14.html",         "icon": "🏠", "label": "14. Smart Home" },
    { "href": "module-15.html",         "icon": "🏥", "label": "15. Telehealth" },
    { "href": "module-16-travel-safety.html", "icon": "✈️", "label": "16. Travel Safety" },
    { "href": "module-17-ai-research.html",   "icon": "🔍", "label": "17. AI Research" },
    { "href": "module-18-staying-connected.html", "icon": "💙", "label": "18. Connection" },
    { "href": "module-19-digital-legacy.html",    "icon": "📚", "label": "19. Digital Legacy" },
    { "href": "module-20-internet-plan.html",     "icon": "📶", "label": "20. Internet Plans" },
    { "href": "module-21-mobile-plan.html",       "icon": "📱", "label": "21. Mobile Plans" },
    { "href": "module-visual-ai.html",  "icon": "📷", "label": "Show Me! (Bonus)" },
    { "href": "family-setup.html",      "icon": "👪", "label": "Set Up for a Loved One" },
    { "href": "resources.html",         "icon": "📚", "label": "Resources" },
    { "href": "tips/index.html",        "icon": "💡", "label": "Tips & Updates" },
    { "href": "resources/living-alone.html", "icon": "🏡", "label": "Living Alone Safely" },
    { "href": "print-centre.html",      "icon": "🖨️", "label": "Print Centre" },
    { "href": "recommended-tools.html", "icon": "⭐", "label": "Recommended Tools" },
    { "href": "scam-simulator.html",    "icon": "🎯", "label": "Scam Simulator" },
    { "href": "resources/support-directory.html", "icon": "🆘", "label": "Get Help" }
  ]
}
